requirement_id,requirement,status,evidence,remaining_work,authoritative_artifacts
R10_permeability_field_fit,Fit or rank heterogeneous anisotropic permeability fields against currently active data.,partial,"Executed combined candidates=65; regularized OGS mode=execute; best executed candidate=basis_024_det_l_0p0075_s_1p000; best combined active objective=3156.353066948979; first adaptive batch best=length_0p050m (3276.565238233279); local refinement best=length_0p013m (3159.6643814648755); local bracketing best=length_0p013m_shift_1p125 (3167.2098371738107); optimizer-proposed batch best=length_0p019m_shift_0p875 (3172.373457220063); continuous-proposal batch best=length_0p006m_shift_0p992 (3156.7841213432516); broad continuous batch best=length_0p023m_shift_1p004 (3159.0596578385903); broad continuous cumulative best=length_0p010m (3157.702128613753); lower-support continuous batch best=length_0p004m_shift_0p995 (3156.3785563886977); latest continuous-loop batch best=length_0p010m (3157.702128613753); post-loop best=length_0p003m_shift_1p006 (3156.3730086472674); active components=2; state active rows=192; direct RMSE=1.61071549171474; permeability residual conflict audit status=permeability_residual_conflict_audit_generated, active rows=75, |residual|>=1 log10 rows=48, |residual|>=2 log10 rows=21, outside configured scalar range=2, repeated support cells=24, support cells with observed range >=1 log10=16; permeability likelihood policy status=permeability_likelihood_policy_audit_generated, support-cell mean diagnostic objective=1.7670484276950664e-28, support-cell median diagnostic objective=134.72779043641356, top-10 row-loss share=0.49400403343820803, decision request=permeability_likelihood_decision_request_generated; configured-scalar outlier disposition status=permeability_configured_scalar_outlier_disposition_generated, outlier rows/groups=2/1, max envelope excess=0.10719186674877967, max same-support range=6.948847477552619, bounds release now=False, tensor-shape release now=False; support lower-bound audit status=permeability_support_lower_bound_audit_generated, single-support lower-bound objective=269.8180571059851, same-support reducible gap=0.0, current at lower bound=True, support groups with observed range >=2 log10=16; support-conflict spatial audit status=permeability_support_conflict_spatial_audit_generated, mesh cells=10239, active support cells=30, repeated support cells=24, support cells with range >=1/>=2 log10=16/16, configured-scalar conflict cells=1, top conflict cell=4648 (BCD-A32 at 0.85-0.87 m, observed range=6.948847477552619); release gate=pass; global release checks=1300; next-batch proposals=6; top proposal=length_0p008m_shift_1p011; proposal mode=local_refinement_after_state_response; finite-candidate optimizer top=length_0p003m_shift_0p972; optimizer acquisition=lcb; continuous proposals=136; continuous top=length_0p009m_shift_0p979; continuous top predicted objective=3158.112102075178; anisotropy sensitivity candidates=35; best anisotropy direct candidate=anis_theta_144p0_ratio_2p50 (delta=0.0); local-basis sampler candidates=131; local-basis anchors=30; best local-basis direct candidate=basis_004_det_l_0p0015_s_1p000 (delta=-0.01743135794737327); local-anisotropy sampler candidates=80; local-anisotropy anchors=30; best local-anisotropy direct candidate=local_anis_isotropize_l0p015_s0p5_r1 (delta=0.18992005641422338); local-basis OGS batch best=basis_024_det_l_0p0075_s_1p000 (3156.353066948979); production OGS rounds best=basis_023_det_l_0p0075_s_0p750 (3156.3547580979066); production OGS rounds=5; production sampler evidence rows=65; production candidate pool=394; production executable unexecuted candidates=210; production top proposal=length_0p007m_shift_1p020 (smooth); production CV state RMSE=10.430369372008784; production stop/continue decision=pause_active_production_sampling; cross-stream best mean-rank run=local_basis_sampler_003_basis_029_det_l_0p0100_s_1p000 (mean rank=10.4, worst rank=18.0); active incumbent cross-stream ranks: NMR-bias=14.0, ERT=8.0, Taupe=29.0; cross-stream hybrid field screen candidates=15 from 5 target winner runs; best direct hybrid=cross_hybrid_mean_rank_all_streams_plus2_a0p25 with delta=0.0; structural/EDZ field-family screen status=structural_edz_direct_screen_no_ogs_batch_recommended, candidates=234, improving direct candidates=0, best=struct_bedding_parallel_band_bed_om0p75_w0p25_a0p5 (bedding_parallel_band) with delta=0.0; current field package status=current_permeability_field_package_generated, run=local_basis_sampler_002_basis_024_det_l_0p0075_s_1p000, cells=10239, positive-definite cells=10239, median log10 eigen-permeability=(-19.385282356749467, -18.98734234807743), anisotropy p50=2.4999999999999996, theta p50=144.0; current field reproducibility audit status=current_field_reproducibility_verified, checks=19, required failures=0, manifest rows=46, run-input files=25, project refs=15, residual rows direct/state=75/192; current field visual inspection=current_field_visual_inspection_generated, images=6, rendered positive-definite cells=10239, log10 geometric-mean permeability p50=-19.18631235241345, nearest-anchor distance p50=1.3341074008425977 m; frozen-model/measurement inclusion audit=pass, checks=13, measurement-info rows=206, archive rows=1880, workbook sheet rows=34, promotion guard=do_not_promote_current_field; current field selection audit status=current_field_selection_audit_generated, active decision=accept_as_current_active_objective_incumbent, final all-measurement decision=do_not_promote_to_final_all_measurement_field, status counts={'pass': 2, 'pass_with_caveat': 2, 'fails_final_promotion': 2, 'blocked_or_gated': 4}; conditional field scenarios status=conditional_field_selection_scenarios_generated, scenarios=8, unique winners=5, current-field wins=1, final decision=single_field_not_stable_across_gate_scenarios; conditional field candidate package status=conditional_field_candidate_package_generated, candidates=5, selection stability=unstable_across_defined_scenarios, diagnostic metric evidence rows=25, missing metric rows=0; conditional field difference audit status=conditional_field_difference_audit_generated, compared fields=4, cells=10239, largest-difference candidate=local_bracketed_003_length_0p031m, max mean abs delta log10 k=0.03774483756924675, max cells over 0.05/0.10 log10=241/233; final promotion checklist status=final_inversion_promotion_checklist_generated, decision=do_not_promote_current_field, criteria=17, open criteria=9, status counts={'active_only_pass': 2, 'blocked_external': 6, 'blocked_internal_decision': 1, 'fails_promotion': 2, 'pass': 5, 'pass_with_caveat': 1}; permeability next field-fit gate status=permeability_next_field_fit_gate_generated, recommendation=pause_same_support_active_objective_ogs_until_likelihood_support_bounds_or_stream_gate_changes, gates=8, same-support active-objective batch executable now=False, gate statuses={'available_for_inspection_active_only': 1, 'blocked_by_external_stream_gates': 1, 'blocked_by_support_conflicts_and_endpoint_geometry': 1, 'blocked_until_policy_approved_and_ogs_executed': 1, 'do_not_run_more_same_support_sampling_now': 1, 'local_outlier_disposition_recorded_policy_still_required': 1, 'not_ready_until_objective_finalized': 1, 'rowwise_gaussian_default_retained_for_current_report': 1}.","The current best executed field is now packaged for inspection and rerun provenance. The smooth magnitude, global anisotropy-angle/ratio, first local-basis magnitude family, local tensor-anisotropy screen, cross-family production sampler rounds, cross-stream hybrid magnitude blends, and structural/EDZ cap/shell/bedding/corridor screen have now been checked. The residual conflict, spatial support-conflict, likelihood-policy, configured-scalar outlier-disposition, and support lower-bound audits show the remaining direct mismatch is concentrated in large pulse-test residuals and repeated support-cell conflicts; the two scalar-envelope rows are now classified as one duplicated minor upper-envelope exceedance that does not by itself justify bounds widening or tensor-shape release. The accepted field is already at the single-support lower bound for the current support map. The next field-fit gate now records that no same-support active-objective batch is executable under the current row-Gaussian policy, and the likelihood-policy acceptance template records that no primary policy approval exists yet. Reopen OGS spending only after a support/likelihood/bounds/tensor-shape decision or accepted measurement-stream objective is recorded; do not accept a final field until the broader stream gates are resolved or explicitly excluded.",inversion_workflow/scripts/run_continuous_inversion_loop.py; inversion_workflow/scripts/build_anisotropy_sensitivity_plan.py; inversion_workflow/scripts/build_local_basis_sampler_plan.py; inversion_workflow/scripts/build_local_anisotropy_sampler_plan.py; inversion_workflow/scripts/build_production_sampler_convergence_audit.py; inversion_workflow/scripts/build_cross_stream_candidate_scorecard.py; inversion_workflow/scripts/build_cross_stream_hybrid_field_plan.py; inversion_workflow/scripts/build_structural_edz_field_family_plan.py; inversion_workflow/scripts/build_permeability_residual_conflict_audit.py; inversion_workflow/scripts/build_permeability_support_conflict_spatial_audit.py; inversion_workflow/scripts/build_permeability_likelihood_policy_audit.py; inversion_workflow/scripts/build_permeability_support_lower_bound_audit.py; inversion_workflow/scripts/build_permeability_likelihood_decision_request.py; inversion_workflow/scripts/build_permeability_configured_scalar_outlier_disposition.py; inversion_workflow/scripts/build_permeability_next_field_fit_gate.py; inversion_workflow/scripts/build_permeability_likelihood_policy_acceptance_template.py; inversion_workflow/scripts/build_current_permeability_field_package.py; inversion_workflow/scripts/build_current_field_reproducibility_audit.py; inversion_workflow/scripts/build_current_field_visual_inspection.py; inversion_workflow/scripts/build_current_field_selection_audit.py; inversion_workflow/scripts/build_conditional_field_selection_scenarios.py; inversion_workflow/scripts/build_conditional_field_candidate_package.py; inversion_workflow/scripts/build_conditional_field_difference_audit.py; inversion_workflow/scripts/build_final_inversion_promotion_checklist.py; inversion_workflow/scripts/build_frozen_model_measurement_inclusion_audit.py; inversion_workflow/permeability_residual_conflict_audit.md; inversion_workflow/permeability_support_conflict_spatial_audit.md; inversion_workflow/permeability_likelihood_policy_audit.md; inversion_workflow/permeability_support_lower_bound_audit.md; inversion_workflow/permeability_likelihood_decision_request.md; inversion_workflow/permeability_configured_scalar_outlier_disposition.md; inversion_workflow/permeability_next_field_fit_gate.md; inversion_workflow/permeability_likelihood_policy_acceptance_record_template.md; inversion_workflow/current_permeability_field/CURRENT_PERMEABILITY_FIELD.md; inversion_workflow/current_permeability_field/CURRENT_FIELD_REPRODUCIBILITY_AUDIT.md; inversion_workflow/current_permeability_field/visual_inspection/CURRENT_FIELD_VISUAL_INSPECTION.md; inversion_workflow/current_permeability_field/current_best_bulk_w_projections.vtu; inversion_workflow/current_field_selection_audit.md; inversion_workflow/frozen_model_measurement_inclusion_audit.md; inversion_workflow/conditional_field_selection_scenarios.md; inversion_workflow/conditional_field_candidates/CONDITIONAL_FIELD_CANDIDATES.md; inversion_workflow/conditional_field_candidates/CONDITIONAL_FIELD_DIFFERENCE_AUDIT.md; inversion_workflow/final_inversion_promotion_checklist.md; inversion_workflow/runs/continuous_inversion_loop/; inversion_workflow/runs/anisotropy_sensitivity_plan/; inversion_workflow/runs/local_basis_sampler_plan/; inversion_workflow/runs/local_anisotropy_sampler_plan/; inversion_workflow/runs/production_sampler_convergence/; inversion_workflow/runs/cross_stream_hybrid_field_plan/; inversion_workflow/runs/structural_edz_field_family_plan/; inversion_workflow/runs/regularized_ogs_candidate_set/; inversion_workflow/runs/adaptive_combined_candidate_plan/; inversion_workflow/runs/bayesian_candidate_proposal/; inversion_workflow/runs/continuous_bayesian_candidate_plan/; inversion_workflow/runs/lower_support_continuous_candidate_plan/; inversion_workflow/runs/smooth_permeability_candidate_search/; inversion_workflow/cross_stream_candidate_scorecard.md
R11_ogs_execution,Execute the prepared OGS model and sample pressure/saturation/temperature/displacement/porosity outputs.,achieved_with_tracked_caveats,"OGS environment status=ogs_container_found_runtime_available; selected executable/container=/home/ber0061/Repositories/gesa_mails/cda_knowledge_base/file_transfers/collected/2025-04-04_2d_model_container/apptainer_ogs6.5.4.sif; recorded execution backend=docker_apptainer_sif; sampled OGS outputs=83; sampled state rows=37184; active state rows=192; state evaluation counts={'boundary_forcing_target_no_state_residual': 4247, 'evaluated': 192, 'external_projection_required': 1691, 'outside_time_tolerance': 95, 'target_not_usable_for_current_state_fit': 5265}.","Keep the fixed-porosity support fallback explicit, keep Taupe as a diagnostic trend screen, and resolve remaining ERT/Taupe/RH gates.",inversion_workflow/OGS_ENVIRONMENT_AUDIT.md; inversion_workflow/scripts/run_ogs_model.py; inversion_workflow/scripts/sample_ogs_state_outputs.py
R12_full_combined_inversion,"Use all defensible measurements to fit permeability, and possibly later parameter fields, in a combined objective.",partial,"Active objective groups now=2; state targets prepared=11490; sampled state rows=37184; active state objective rows=192; best executed combined objective=3156.353066948979; best executed state rows=192; permeability residual audit active rows=75, |residual|>=1 log10 rows=48, outside configured scalar range=2; permeability likelihood policy support-mean objective=1.7670484276950664e-28, conflict support groups=16, top-10 row-loss share=0.49400403343820803, decision request=permeability_likelihood_decision_request_generated; configured-scalar outlier disposition=permeability_configured_scalar_outlier_disposition_generated, rows/groups=2/1, max envelope excess=0.10719186674877967, bounds release now=False, tensor-shape release now=False; support lower-bound status=permeability_support_lower_bound_audit_generated, single-support lower-bound objective=269.8180571059851, same-support reducible fraction=0.0, current at lower bound=True; support-conflict spatial audit=permeability_support_conflict_spatial_audit_generated, active/repeated/range>=2 cells=30/24/16; first adaptive batch best objective=3276.565238233279; local refinement best objective=3159.6643814648755; local bracketing best objective=3167.2098371738107; optimizer-proposed batch best objective=3172.373457220063; continuous-proposal batch best objective=3156.7841213432516; broad continuous batch best objective=3159.0596578385903; broad continuous cumulative best objective=3157.702128613753; lower-support continuous batch best objective=3156.3785563886977; latest continuous-loop batch best objective=3157.702128613753; post-loop best objective=3156.3730086472674; adaptive proposals=6; state term flat over executed candidates=False; optimizer top proposal=length_0p003m_shift_0p972; optimizer best executed objective=3156.3730086472674; continuous proposal count=136; continuous top proposal=length_0p009m_shift_0p979; continuous top P(improve)=2.7537604614526586e-07; anisotropy direct best=anis_theta_144p0_ratio_2p50 with delta=0.0; local-basis direct best=basis_004_det_l_0p0015_s_1p000 with delta=-0.01743135794737327; local-anisotropy direct best=local_anis_isotropize_l0p015_s0p5_r1 with delta=0.18992005641422338; local-basis OGS best=basis_024_det_l_0p0075_s_1p000 with objective=3156.353066948979; production OGS rounds best=basis_023_det_l_0p0075_s_0p750 with objective=3156.3547580979066; production OGS rounds=5; production sampler top=length_0p007m_shift_1p020 (smooth) with P(improve)=0.01657360931530728; production executable proposals=210; production nonexecutable diagnostic rows=119; production stop/continue decision=pause_active_production_sampling; cross-stream joined runs=66; cross-stream Pareto candidates=23; top-10-all-stream candidates=0; best mean-rank cross-stream run=local_basis_sampler_003_basis_029_det_l_0p0100_s_1p000; cross-stream hybrid screen candidates=15; best hybrid direct delta=0.0; structural/EDZ screen status=structural_edz_direct_screen_no_ogs_batch_recommended; candidates=234; improving candidates=0; best structural/EDZ direct delta=0.0; current field package ready=True; current field visual inspection=current_field_visual_inspection_generated with 6 maps; frozen-model/measurement audit=pass with 13 checks and 8 open final-promotion blockers; current field deliverable status=best_executed_active_objective_candidate_not_final_all_measurement_inversion; current field selection final decision=do_not_promote_to_final_all_measurement_field; selection audit failing-final criteria=2; selection audit blocked/gated criteria=4; conditional field scenario final decision=single_field_not_stable_across_gate_scenarios; conditional scenarios=8, unique scenario winners=5, current-field wins=1; conditional field package candidates=5, stability=unstable_across_defined_scenarios, diagnostic metric evidence rows=25, missing metric rows=0; conditional field difference compared fields=4, largest-difference candidate=local_bracketed_003_length_0p031m, max mean abs delta log10 k=0.03774483756924675, max cells over 0.10 log10=233; final promotion checklist decision=do_not_promote_current_field, open criteria=9, status counts={'active_only_pass': 2, 'blocked_external': 6, 'blocked_internal_decision': 1, 'fails_promotion': 2, 'pass': 5, 'pass_with_caveat': 1}; final objective decision register status=final_objective_decision_register_generated, decisions=9, pending/not-ready=9, status counts={'not_ready_for_final_approval': 1, 'pending_after_stream_include_exclude_decisions': 1, 'pending_modelling_team_final_policy': 1, 'pending_user_send_and_provider_response_or_explicit_exclusion': 6}; final objective scenario matrix status=final_objective_scenario_matrix_generated, options=9, current-field winning options=2, unique winners=5, unscored future options=1; final objective no-new-evidence closeout draft status=final_objective_no_new_evidence_closeout_draft_generated, draft decisions=9, external/provenance rows=6, internal rows=1, scenario/final rows=2, would-select scenario=F01_current_raw_nmr_exclude_gated_streams, would-select winner=local_basis_sampler_002_basis_024_det_l_0p0075_s_1p000, current field is draft-scenario winner=True, records decisions=False, promotes field=False, unblocks promotion=False; acceptance template status=final_objective_no_new_evidence_acceptance_record_template_generated, approvals recorded/required=0/9, ready to apply=False, records decisions=False, promotes field=False; permeability next field-fit gate status=permeability_next_field_fit_gate_generated, recommendation=pause_same_support_active_objective_ogs_until_likelihood_support_bounds_or_stream_gate_changes, same-support active-objective batch executable now=False; NMR trend/anomaly follow-up recommendation=pause_new_trend_anomaly_ogs_batch, best unevaluated candidate=basis_034_det_l_0p0150_s_1p000, best unevaluated direct advantage=0.011974871836514467, unevaluated runnable candidates=305.","The continuous proposal loop has made the batch workflow repeatable, the direct anisotropy check does not justify a global angle/ratio-only OGS batch, the first local-basis OGS batch finds only a tiny combined-objective improvement, the local tensor-anisotropy screen worsens the direct objective, the executed production sampler rounds did not improve that incumbent, the cross-stream hybrid screen found no direct-improving blend, the structural/EDZ cap/shell/bedding/corridor screen found no direct-improving candidate, and the residual conflict plus likelihood/support lower-bound audits show many remaining pulse-test residuals are irreducible under the current one-value-per-support-cell map. The configured-scalar outlier disposition narrows the bounds/tensor-shape question: the two scalar-envelope rows are one duplicated minor upper-envelope exceedance and do not by themselves justify releasing bounds or tensor shape. The next field-fit gate therefore blocks another same-support active-objective batch until support/measurement interpretation, robust/aggregation likelihood semantics, an accepted configured-bound/tensor-shape decision, or external ERT/Taupe/RH gates change; the likelihood-policy acceptance template currently records no primary approval for such a change. The no-new-evidence closeout draft gives exact conservative text for choosing the narrow F01 scenario, but it still requires approval, decision-record edits, and regenerated scenario/current-field/promotion audits before any field label changes; choose one explicit final-objective scenario from the scenario matrix before claiming a full combined inversion.",inversion_workflow/scripts/evaluate_inversion_candidate.py; inversion_workflow/scripts/run_inversion_candidate_search.py; inversion_workflow/scripts/run_continuous_inversion_loop.py; inversion_workflow/scripts/build_bayesian_candidate_proposal.py; inversion_workflow/scripts/build_continuous_bayesian_candidate_plan.py; inversion_workflow/scripts/build_anisotropy_sensitivity_plan.py; inversion_workflow/scripts/build_local_basis_sampler_plan.py; inversion_workflow/scripts/build_local_anisotropy_sampler_plan.py; inversion_workflow/scripts/build_production_sampler_convergence_audit.py; inversion_workflow/scripts/build_cross_stream_candidate_scorecard.py; inversion_workflow/scripts/build_cross_stream_hybrid_field_plan.py; inversion_workflow/scripts/build_structural_edz_field_family_plan.py; inversion_workflow/scripts/build_permeability_residual_conflict_audit.py; inversion_workflow/scripts/build_permeability_support_conflict_spatial_audit.py; inversion_workflow/scripts/build_permeability_likelihood_policy_audit.py; inversion_workflow/scripts/build_permeability_support_lower_bound_audit.py; inversion_workflow/scripts/build_permeability_likelihood_decision_request.py; inversion_workflow/scripts/build_permeability_configured_scalar_outlier_disposition.py; inversion_workflow/scripts/build_permeability_next_field_fit_gate.py; inversion_workflow/scripts/build_permeability_likelihood_policy_acceptance_template.py; inversion_workflow/scripts/build_current_field_selection_audit.py; inversion_workflow/scripts/build_conditional_field_selection_scenarios.py; inversion_workflow/scripts/build_conditional_field_candidate_package.py; inversion_workflow/scripts/build_conditional_field_difference_audit.py; inversion_workflow/scripts/build_final_objective_decision_register.py; inversion_workflow/scripts/build_final_objective_scenario_matrix.py; inversion_workflow/scripts/build_final_objective_no_new_evidence_closeout_draft.py; inversion_workflow/scripts/build_final_objective_no_new_evidence_acceptance_template.py; inversion_workflow/scripts/build_nmr_trend_anomaly_followup_plan.py; inversion_workflow/scripts/build_frozen_model_measurement_inclusion_audit.py; inversion_workflow/permeability_residual_conflict_audit.md; inversion_workflow/permeability_support_conflict_spatial_audit.md; inversion_workflow/permeability_likelihood_policy_audit.md; inversion_workflow/permeability_support_lower_bound_audit.md; inversion_workflow/permeability_likelihood_decision_request.md; inversion_workflow/permeability_configured_scalar_outlier_disposition.md; inversion_workflow/permeability_next_field_fit_gate.md; inversion_workflow/permeability_likelihood_policy_acceptance_record_template.md; inversion_workflow/runs/continuous_inversion_loop/; inversion_workflow/runs/anisotropy_sensitivity_plan/; inversion_workflow/runs/local_basis_sampler_plan/; inversion_workflow/runs/local_anisotropy_sampler_plan/; inversion_workflow/runs/production_sampler_convergence/; inversion_workflow/runs/cross_stream_hybrid_field_plan/; inversion_workflow/runs/structural_edz_field_family_plan/; inversion_workflow/runs/nmr_trend_anomaly_followup_plan/; inversion_workflow/runs/adaptive_combined_candidate_plan/; inversion_workflow/runs/bayesian_candidate_proposal/; inversion_workflow/runs/continuous_bayesian_candidate_plan/; inversion_workflow/runs/lower_support_continuous_candidate_plan/; inversion_workflow/measurement_likelihood_model.md; inversion_workflow/cross_stream_candidate_scorecard.md; inversion_workflow/current_field_selection_audit.md; inversion_workflow/frozen_model_measurement_inclusion_audit.md; inversion_workflow/conditional_field_selection_scenarios.md; inversion_workflow/conditional_field_candidates/CONDITIONAL_FIELD_CANDIDATES.md; inversion_workflow/conditional_field_candidates/CONDITIONAL_FIELD_DIFFERENCE_AUDIT.md; inversion_workflow/final_objective_decision_register.md; inversion_workflow/final_objective_scenario_matrix.md; inversion_workflow/final_objective_no_new_evidence_closeout_draft.md; inversion_workflow/final_objective_no_new_evidence_acceptance_record_template.md
