stream,promotion_decision,current_model_role,active_objective_rows,gate_count,required_gate_count,pass_count,warn_count,fail_count,missing_evidence_count,hard_blockers,tracked_caveats,next_action,primary_artifacts
nmr_water_content,active_with_tracked_caveats,active state likelihood from sampled theta=phi*S_l rows,192,2,2,1,1,0,0,,Raw absolute theta residuals remain conditional until a free-water/bound-water correction or anomaly residual is accepted.,Keep active but conditional; decide whether final objective uses label-bias or trend/anomaly residual.,state_observation_evaluation_summary.json; nmr_bound_water_sensitivity_summary.json
permeability_pulse_tests,active_with_tracked_caveats,active direct parameter likelihood on k_i_rd directional permeability,75,3,3,2,1,0,0,,Gas/slip/liquid-equivalent interpretation remains a tracked model-error caveat.,Keep active; obtain endpoint geometry if older permeability rows should enter.,permeability_observation_targets.csv; permeability_fit_summary.json
geometry_support,support_layer_ready,"support/prior layer, not a likelihood residual",0,1,0,1,0,0,0,,,Continue propagating mapping status; add missing historical endpoint geometry where needed.,measurement_mesh_lookup.csv; borehole_line_mesh_samples.csv
model_projection_inputs,support_layer_ready,run-local mesh-field injection and release-gate guard,0,1,0,1,0,0,0,,,Keep using release-gated run preparation; do not release later parameters until stream gates pass.,inversion_release_gate_audit.md; inversion_parameter_release_plan.md
ert_resistivity,diagnostic_only,external resistivity diagnostic under assumed transform/support,0,3,3,1,0,2,0,"ERT-to-OGS transform and exact near-niche support mask remain assumed, not confirmed.; No defensible ERT residual sigma/correlation model is available; pixels cannot be treated as independent rows.",,"Confirm ERT-to-OGS transform, exact support mask, and inversion uncertainty/correlation before assigning weights.",ert_resistivity_diagnostic_summary.json; ert_support_sensitivity_summary.json
taupe_tdr,diagnostic_only,baseline-normalized trend diagnostic on mapped A3/A4 bands,0,4,4,1,2,1,0,"Taupe values are not confirmed as volumetric water-content percent, permittivity, or another ARDP-derived proxy.",Series-specific uncertainty and grouped weighting remain part of the calibration gate.; A7/A8 remain outside the current Niche-4 mesh support.,Confirm Taupe workbook units/calibration and adopt a grouped uncertainty model; A7/A8 remain outside support.,taupe_tdr_trend_diagnostic_summary.json; taupe_series_weight_sensitivity_summary.json
relative_humidity_suction,boundary_audit_only,boundary forcing provenance and Kelvin-pressure consistency audit,0,3,3,1,0,2,0,"Active boundary curve generation, sensor screening, time axis, constants, and extension policy are not confirmed.; Local RH-derived envelope is quantified but not accepted as replacement forcing or retention likelihood.",,Get BGR/Gesa provenance for active open-niche pressure curve before replacement forcing or retention likelihood.,rh_boundary_provenance_request_summary.json; rh_boundary_uncertainty_summary.json
other_hm_monitoring,not_ready_for_hard_residual,qualitative validation and support geometry only,0,3,2,1,0,2,0,"Local source scan found layout geometry, laser surface geometry, extracted levelling slide rows, and report/minute evidence, but no hard-residual-ready Geoscope time series, laser statistical interpretation product, or full levelling survey table.; Required metadata for hard HM residual weights are absent from the current local bundle.",,"Locate Geoscope, laser-scan, and levelling numeric exports with epochs, units, support, and uncertainty.",other_hm_numeric_source_audit_summary.json; other_hm_missing_numeric_request.md
